hotels,names,titles,star_ratting,location,date,comments,replies
六福客棧The Leofoo Hotel,Saqqkiss,房間還不錯,5,,2018年11月,我們是訂家庭房的，有股味道，但還可以接受，很寬敞，小朋友們鬧來鬧去也可以，不過旅館服務人員有提醒我們小聲點，她們真的很貼心，值得推薦。,親愛的貴賓您好，感謝您蒞臨六福客棧，很開心有為您服務的機會。再次感謝您的蒞臨，希望未來很快能有再次為您服務的機會，我們也將以更卓越的服務，讓您再次感到驚艷。
洛碁大飯店花華本館Flora Hotel Main,sarahcheung523,價錢合理,4,Hong Kong,2018年10月,"飯店雖然有點歷史，但整體來講不錯。
我訂的是雙人間含早餐，給我的房間為一張雙人床和一張單人床，棒。
洗手間很乾淨，清潔阿姨會為住客補上用完的用品，每天都有2瓶飲用水提供。
吃早餐的地方不在這一幢樓，在對面馬路的副館的地下一樓，如果對早餐沒有很高要求的話，可以去享用，否則飯店附近也有大量早餐店可以選擇。
飯店樓下就有一家7-11，...更多",
洛碁大飯店花華本館Flora Hotel Main,raytam0915,前堂服務員服務態度十分無禮,1,香港,2018年1月,"前堂服務員服務態度十分無禮。
一向對此酒店都滿有好感、需然設施比較殘舊、但價格及位置各方面亦算不錯。
上一次入住時、因為朋友買的機場巴士卷有問題、而我們的電話亦只能上網、所以我們就在最後一天Check out 時有禮貌地要求前堂服務員、希望能幫我們撥打巴士卷上的聯絡電話、而我們也有表示如果打電話要收費亦冇問題、但該前堂服務員竟然...更多",
洛碁大飯店花華本館Flora Hotel Main,ChinKF,三星級酒店，早餐很棒，地理位置優越，靠近台北車站,5,,2018年11月,"雖然附近有十幾家經濟型酒店，但是這家老酒店比其他同類酒店更好的是它的各種早餐。它融合了亞洲和西方菜餚，包括各種飲料。咖啡還不錯。我沒有抱怨必須走到它的附屬分店吃早餐，因為它只是一箭之遙，就在酒店旁邊的7-11對面。如果您特別關注早餐而且不介意舊的酒店設置（例如仍然使用房間鑰匙，浴缸等）和比我的21英寸台式顯示器小的小型平板電視，那麼這家酒店是一個不錯的選擇。大多數經濟型酒店僅提供早餐券，可在附近的其他餐廳兌換。
如果您乘坐機場地鐵到達大行李，您可以乘坐電梯到台北車站的Z 2出口到Shikong Dept Store。否則，你必須在其他Z出口處與沈重的行李箱掙扎。從機場地鐵台北中央火車站到酒店的步行時間約為10分鐘。
只有一個抱怨：一個接待員給我錯誤的房間鑰匙號碼後，我從早上11點回到酒店。今天上午00點。不僅我必須立即回到接待員櫃檯返回錯誤的鑰匙，而且我認為她應該更加警惕，以避免由於她的錯誤導致任何可能的安全問題。",
洛碁大飯店花華本館Flora Hotel Main,ZenithWanderer,值得一提的是免費早餐,4,菲律賓馬加智,2018年5月,"優點：
 1。靠近台北車站，乘坐火車站和公交車站都很方便。
 2。免費早餐 - 健康早餐！
 3。房間很舒服，雖然我們的尺寸相當小。
 4。靠近便利店和商店
缺點：
 1。菲律賓比索沒有貨幣兌換商
 2。蚊子是一個問題，尤其是在大廳",
歐華酒店The Riviera Hotel,catherine0815,美好的住宿體驗,5,,2018年12月,"12月來台灣旅遊,很高興住宿於歐華酒店.飯店有提供免費的旅遊景點送車服務,30分前預約就可以,這次我們去故宮及101!解瞭了一下幾乎台北市想去的知名旅遊景點都包含了!一樓還有歐麗蛋糕坊,鳳梨酥及達克瓦茲包裝精美又很美味!我們買了一些伴手禮回去送朋友.整體來說這間飯店硬體設備及親切的服務令人激賞!非常感謝!",
歐華酒店The Riviera Hotel,Trek51663404234,讚,5,,2018年12月,飯店人員服務不錯，有賓至如歸的感覺。高樓層窗外景觀很好，可以看到飛機。整體來說頗有質感，在台北市以中小型飯店來說算是不錯的選擇。,"親愛的貴賓 您好,

非常感謝您撥冗提供給我們寶貴的住宿心得，我們很高興成為您台北之行的下榻酒店。謝謝您對飯店的高評價及肯定，您的評論將進一步激勵酒店所有同仁持續努力讓每位貴賓享受賓至如歸的服務。

希望很快能夠再次歡迎您蒞臨台北歐華酒店，並期待您下次入住時，有個更美好盡興的住宿體驗。

祝 順心

台北歐華酒店 敬上"
歐華酒店The Riviera Hotel,Sightseer62621254208,值得再次入住,5,香港,2018年12月,此次來台北旅遊，入住五晚。價格合理，酒店前台服務熱情，酒店地理位置不錯，出行方便。非常滿意，下次來台北仍會考慮入住。,"親愛的貴賓 您好,

非常感謝您撥冗提供給我們寶貴的住宿心得，我們很高興成為您台北之行的下榻酒店。謝謝您對飯店的高評價及肯定，您的評論將進一步激勵酒店所有同仁持續努力讓每位貴賓享受賓至如歸的服務。

希望很快能夠再次歡迎您蒞臨台北歐華酒店，並期待您下次入住時，有個更美好盡興的住宿體驗。

祝 順心

台北歐華酒店 敬上"
歐華酒店The Riviera Hotel,travellerRo,非常有魅力，非常乾淨的酒店。,5,"Manila, Philippines",,酒店很好找，離中山小學/捷運站步行5-10分鐘即可到達。酒店的工作人員很友好，房間很乾凈。內部裝飾很迷人，房間寬敞。508房間工作空間寬敞，浴室整潔。強烈推薦，肯定會再去的。我可以在附近的雜貨店買到新鮮可口的水果。更多,"Dear Mr./Ms. travellerRona,

Greeting from the Riviera Hotel Taipei. 

Many thanks for taking the time to let us know about...更多"
歐華酒店The Riviera Hotel,Global11038896741,台北商旅/觀光首選酒店,5,天津地區天津市,,酒店位置優越，客房整齊乾淨。前台、門廳、客房、餐廳服務都是一流，真正是賓至如歸！ 早餐如能增加一些中式特色小吃就更完美了，比如粉、面等等。謝謝！,"亲爱的贵宾 您好, 

非常感谢您拨冗提供给我们宝贵的住宿心得，我们很高兴成为您台北之行的下榻酒店。

谢谢您对饭店的高评价及肯定，您的评论将进一步激励酒店所有同仁持续努力让每位贵宾享受宾至如归的服务。同时也谢谢您给予的意见与指教，我们已经将您的宝贵意见于第一时间回馈给相关部门并作为未来改善的参考。 

希望很快能够再次欢迎您莅临台北欧华酒店，并期待您下次入住时，有个更美好尽兴的住宿体验。 

祝 顺心 

台北欧华酒店 敬上"
慶泰大飯店Gala Hotel,Loek J,這是家很好的酒店，在台北的市中心，還有兩家很棒的餐廳。,4,,,我們在這家酒店住過兩次，都是之前來台灣旅遊的時候住的。兩次我們的房間都昇級到了舒適的卧室，是和房間的其他部分和廁所分開的那種。浴室也很好，淋浴很棒。有免費的WIFI。這裏的兩個餐廳我們都去吃過，都很喜歡。其中一家是真正的中餐廳，另一家餐廳有三種不同的套餐可以選擇，是很棒的自助餐。這裏的早餐分量很大，食物的種類也很多。更多,Thank you for taking the time to share your positive experience with us. We are pleased to read that you...更多
慶泰大飯店Gala Hotel,BrileyC1,服務溫馨熱情的好旅店,5,,2018年7月,"這次在這飯店住了兩晚，服務人員親切熱情，辦理住退房手續或房間中途清潔都很有效率。房間大小適中、乾淨雅緻、我太太對清潔標準較高又會認床，每次出遊訂房雖然都會仔細挑過，但有時侯一些細節不是每個飯店都會注意到的。這次的經驗很棒，環境符合我太太的喜好，兩夜也都睡得很好，令我很滿意。
另外值得一提的是，因為臨時決定請北部一些親友吃飯，但台...更多","親愛的貴賓 您好:
感謝您此次選擇慶泰大飯店並在百忙中留下您寶貴的意見。
我們很高興得知您對本飯店的服務及飯店房間感到滿意。此次很榮幸讓我們為您提供舒適的住宿環境與專業的服務，同時您給予飯店的鼓勵與讚美是我們進步的原動力!全體員工會更加努力為每一位貴賓提供更優質的服務、舒適的住宿環境以及值得回憶的體驗.
衷心地期待 您的再度光臨...更多"
慶泰大飯店Gala Hotel,Aprilwu1220,價額不實人員不專業,1,台灣台北,2018年6月,"台灣本國人訂房、外國人訂房、網路上訂房、線上訂房、訂房網站訂房、旅展買的房、價錢大不同，櫃檯人員及訂房人員無法處理就往外推，跟消費者玩文字遊戲把消費者當笨蛋，真的很糟糕
櫃檯、櫃檯值班經理及訂房人員教育訓練需有待加強，辦事效率低，處理方式及態度不專業，人員素質真有待加強。","親愛的貴賓 您好:
感謝您此次選擇慶泰大飯店並在百忙中留下您寶貴的意見。
此次很抱歉造成您的不便，我們會通知相關單位主管，努力提供舒適住宿體驗。
再次感謝您的蒞臨。

慶泰大飯店
禮賓接待部"
慶泰大飯店Gala Hotel,arensince2017,高水準服務好老牌飯店,5,Taipei,2018年3月,老牌飯店，不斷維持在星級飯店的水準，服務相當出色，一進門就被親切的迎接，整個心情都好了起來，日本旅客相當青睞慶泰飯店，房間內部整修過，雖然空間比較小，但住起來是舒服的，浴室不但乾濕分離也有免治馬桶，也希望未來能體驗更大的床鋪，酒店離行天宮站很近。,"親愛的貴賓 您好:
感謝您此次選擇慶泰大飯店並在百忙中留下您寶貴的住宿體驗。
我們很高興得知您對本飯店的服務及飯店房間的設備感到滿意。

同時您給予飯店的鼓勵與讚美是我們進步的原動力!
全體員工會更加努力為每一位貴賓提供更優質的服務、舒適的住宿環境以及值得回憶的體驗。

衷心地期待 您的再度光臨!


禮賓接待
安部真理子"
慶泰大飯店Gala Hotel,Culture748218,商品展示會+buffet,3,,2018年3月,廠商的春夏商品展示會辦在這裡，場地非常明亮舒適，餐點多樣化而且好吃！地點又近捷運行天宮站，是商務需求的最佳選擇。,"親愛的貴賓 您好:
感謝您此次蒞臨慶泰大飯店並在百忙中留下您寶貴的意見。
我們很高興得知您對本飯店的服務感到滿意。
希望您的再次蒞臨。"
天成大飯店Cosmos Hotel TAIPEI,Travelite7275,地理位置和服務都很棒,5,Singapore,,這個位置無與倫比。離台北站非常近，附近有許多商店、餐廳、麵包店和咖啡館。一樓的Burger Lab供應美味的漢堡。我們的家庭房（有兩張雙人床）寬敞舒適。有浴缸。從登記入住到禮賓，再到退房，服務都很好！有三部電梯，所以在等待電梯時不會有問題。再來台北時一定會回來這裏！更多,Thank you for taking your time to share your feedback with us. We are so pleased to learn that you...更多
天成大飯店Cosmos Hotel TAIPEI,dicksonhk,台前服務及管理優良,4,,2018年12月,進入天成酒店便看見前台，他們主動問候和看看我們有什麼須要，勤力服務態度，令人十分欣賞他們。他們的笑容可加，每個服務員每時每分都把笑容掛在臉上，像一朵美麗花盛放，令人看起來十分可愛和親切。更多,"親愛的貴賓 您好

感謝您再次選擇入住台北天成飯店，我們非常期望每一位到訪的旅客都能盡情的享受在台北歡樂旅遊時光，台北天成飯店的每位服務人員會非常熱情提供最貼心的服務，讓每一位入住的旅客都賓至如歸的感覺。
謝謝您給與我們前檯服務人員服務的肯定與鼓勵，同時，我們也非常感謝您分享在天成飯店的住宿體驗，您給予整個團隊的支持與讚美都將讓...更多"
天成大飯店Cosmos Hotel TAIPEI,vivicat522,位置優越的天成飯店,5,,2018年12月,很久没來天成飯店了，今天再次拜訪很喜歡大廳乾淨高級的歐洲風味，因為這家飯店剛好在台北車站旁，以後會再次來消費。更多,"親愛的貴賓您好:

感謝您給予寶貴的意見。台北天成大飯店一直以提供客人優質的服務為主要目標。很榮幸同仁的細心服務能深受您的喜愛，我們深感榮幸。誠摯感謝您特地撥空留言，非常榮幸獲得您對飯店的鐘愛，期望有機會能再為您服務，您的滿意就是對我們工作的肯定，天成飯店全體同仁竭誠歡迎您再度光臨。


敬祝 平安順心

Kenny Ho 何梓...更多"
天成大飯店Cosmos Hotel TAIPEI,Getaway586787,舒適溫馨的天成飯店,5,德國漢堡,2018年12月,今天和媽媽來天成飯店，很喜歡這家飯店溫馨又典雅的妝潢，飯店服務人員很親切又漂亮，以後會再來這裡住宿和消費。更多,"親愛的貴賓您好:

感謝您給予寶貴的意見。台北天成大飯店一直以提供客人優質的服務為主要目標。很榮幸同仁的細心服務能深受您的喜愛，我們深感榮幸。誠摯感謝您特地撥空留言，非常榮幸獲得您對飯店的鐘愛，期望有機會能再為您服務，您的滿意就是對我們工作的肯定，天成飯店全體同仁竭誠歡迎您再度光臨。


敬祝 平安順心

Kenny Ho 何梓...更多"
天成大飯店Cosmos Hotel TAIPEI,sakurai1229,整體品質絕佳,5,,2018年12月,"位在台北車站旁，交通非常方便，甚至不用一分鐘就可走到捷運3號出入口。
工作人員非常有禮貌。雖然是比較舊式的飯店，但是房間非常乾淨，床鋪柔軟。
當天還獲得升等的套房式房間，還有大浴缸，覺得非常好。
下次有機會絕對會再拜訪。更多","親愛的貴賓您好:

感謝您給予寶貴的意見。台北天成大飯店一直以提供客人優質的服務為主要目標。很榮幸同仁的細心服務能深受您的喜愛，我們深感榮幸。誠摯感謝您特地撥空留言，非常榮幸獲得您對飯店的鐘愛，期望有機會能再為您服務，您的滿意就是對我們工作的肯定，天成飯店全體同仁竭誠歡迎您再度光臨。


敬祝 平安順心

Kenny Ho 何梓...更多"
"福容大飯店 台北一館Fullon Hotel Taipei,Central",mariel c,酒店房間的美景,4,Manila,,我們在浴室窗口看到了標誌性的台北101酒店房間的美景，距離最近的地鐵站8分鐘，酒店位置非常好，因為您可以輕鬆到達任何景點，當我們再次到台灣旅行的時候，我們一定會再次入住這家酒店更多,"Dear Mr./Mrs./Miss. mariel c     ,
Thank you very much for choosing Fullon Hotel Taipei, Central and taking your valuable time...更多"
"福容大飯店 台北一館Fullon Hotel Taipei,Central",Garfieldnk,CP值很高的飯店,5,台灣台北,2017年11月,房間內的設備很完整，浴室裡有免治馬桶及浴缸，飯店裡也有游泳池，比較可惜的是入住時是11月因此游泳池關閉，早餐的菜色很豐盛。,"親愛的Nicole K 您好
謝謝您選擇入住 福容大飯店台北一館，很感謝您特別撥冗分享您的寶貴經驗，感謝您在住宿期間，對於我們館內房間及各項服務給予肯定，您的意見及分享除了給予我們鼓勵外，亦將作為我們持續進步的依據及方向，福容大飯店台北一館衷心期盼您再次光臨，謝謝 
敬祝美好的一天！
福容大飯店台北一館"
"福容大飯店 台北一館Fullon Hotel Taipei,Central",Wang R,很不錯的地點,4,台灣中正區,2018年6月,就在建國花市對面，鬧中取靜。離捷運站有點遠，離公車站也有點距離。乾淨，小巧，整體來說CP值高。唯一可惜的是大廳往地下一樓的樓梯有一股腥味。,"親愛的Wang R貴賓
謝謝您選擇入住 福容大飯店台北一館，很感謝您特別撥冗分享您的寶貴經驗。
很抱歉此次入住公共區域清潔部分未能達到您的期望，造成不便敬請見諒，您所給予的意見，我們定會進行檢討及改進，竭誠期盼未來能有機會再次為您服務，並請繼續給予我們支持與鼓勵。
敬祝美好的一天！福容大飯店台北一館"
"福容大飯店 台北一館Fullon Hotel Taipei,Central",Luna W,離捷運有點距離,4,Taipei,2018年5月,福容一館剛好在大安站跟忠孝復興站中間，必須得走10分鐘左右的車程，飯店裡面維護的算是不錯👍乾淨用心家族旅遊可以考慮裡面很寬敞,"親愛的Luna W
謝謝您選擇入住 福容大飯店台北一館，很感謝您特別撥冗分享您的寶貴經驗，感謝您在住宿期間，對於我們館內房間及各項服務給予肯定，您的意見及分享除了給予我們鼓勵外，亦將作為我們持續進步的依據及方向，福容大飯店台北一館衷心期盼您再次光臨，謝謝 
敬祝美好的一天！
福容大飯店台北一館"
"福容大飯店 台北一館Fullon Hotel Taipei,Central",AlbertHung,房間安靜舒適，衛浴設備乾淨,4,台灣台北,2018年4月,第一次入住市區的福容飯店原本是打算使用他們的露天泳池，但是自己大意沒有先問清楚開放時間（5/1才開放），但小朋友在浴缸泡澡也是很滿足的。外出帶小朋友去大安森林公園玩耍後再去永康街用餐，都很方便。早餐內容雖然不算非常多元，但是口味都挺不錯的。10樓房間的視野很好，雖然位置鄰近建國高架橋，但是隔音非常好，裡外都沒有噪音（隔壁房門開關...更多,"親愛的AlbertHung貴賓
謝謝您選擇入住 福容大飯店台北一館，很感謝您特別撥冗分享您的寶貴經驗，感謝您在住宿期間，對於我們館內房間及各項服務給予肯定，您的意見及分享除了給予我們鼓勵外，亦將作為我們持續進步的依據及方向，福容大飯店台北一館衷心期盼您再次光臨，謝謝"
首都大飯店Capital Hotel,QuennieCua,舒適、服務、方便,5,菲律賓馬尼拉,,這三方面很突出。地處台北商業區……夜晚很安靜，步行5-8分鐘可達地鐵站，從那兒可以去到任何地方。酒店的早餐很好。經常看看可以在網上發現優惠的價格。絕對會讓你留下難忘的回憶。,
首都大飯店Capital Hotel,ahliao,巨大的房間,4,新加坡新加坡,,巨大的卧室，衛生間也很大！乾淨明亮，帶有一個小陽台。前台工作人員都很有禮貌，總會和每個人打招呼！自助早餐有點太本土化了，沒有太多的國際選擇。,
首都大飯店Capital Hotel,642aaronl,覺得還可以,3,台灣台北,2018年8月,第一次入住就給我升級成三人房，並且在14樓的高層，但是外頭的景觀並不是很好，床也不是很舒適，廁所設施也是普普，就是很大的房間,
首都大飯店Capital Hotel,943assaa,非常好的服務，非常大的房間,5,,,酒店擁有非常寬敞的房間（約45平方米），員工團隊總是面帶微笑，房間非常舒適安靜和乾淨。餐廳里有大量的食物。食物很乾凈，有很多種選擇。,
首都大飯店Capital Hotel,adwangliang,市中心的商務飯店,4,上海地區上海市,2018年5月,飯店位置非常好，在市中心，公共交通很便捷。房間和浴室都很大，但房間緊臨高架路，晚上車輛高速通過有譟音。餐廳不大，早餐可供選擇的品種很少。,
台北君品酒店Palais De Chine Hotel Taipei,HsuB15,開會,4,台灣台北,2018年12月,剛好協會在這裡有開聖誕節的會議，整體的佈置，和服務其實很不錯，只是突然因為連動到捷運，臨時有消防火警的警報，反而看到整個飯店在管理上，消防演練的生疏，這點需要再加強。,
台北君品酒店Palais De Chine Hotel Taipei,Lazysnake_HK,交通方便且服務品質好的酒店,5,,2018年12月,房間寬敞，交通方便，服務周到，特別多謝服務員Con.Nick貼心服務，唯西餐飲的品質有改善空間，下次到台北還會再次入住。,
台北君品酒店Palais De Chine Hotel Taipei,fancywong,交通方便且舒適的酒店,5,香港,2018年12月,"酒店職員 Albert Huang 和 Eric (Duty Manager) , 他們的超水準服務, 令我對此酒店有另一番感受, 房內電視音響效果很好 , 酒店位置及商場地副美食廣場之方便, 我會再次選擇此酒店為我每次到台灣之首選!",
台北君品酒店Palais De Chine Hotel Taipei,bettyl209,非常棒，滿意。,5,,2018年12月,服務好，環境創適。在台北車站附近，地點位置好。房間光線不太足，但是設計風格時尚，是我比較喜歡的風格。更多,"親愛的bettyl209您好，歡迎您蒞臨下榻君品酒店。
謝謝您特別給予我們酒店便利的交通位置、整體的設計風格以及舒適的住宿環境肯定。我們將會秉持提供更完善的服務品質和安全舒適的居住環境給每位蒞臨君品的貴賓，衷心期待往後您的台北之旅都能選擇君品，讓我們再度為您帶來一次次美好的住宿餐飲體驗。
敬祝 美好的一天！
總經理 葛禮祺 Li...更多"
台北君品酒店Palais De Chine Hotel Taipei,MLeung831,一流的酒店,5,,2018年12月,"酒店位置方便，房間舒適，服務人員友善，早餐美味選擇多樣。我和家人都覺得十分滿意，完全找不到可挑剔的地方，下次去台北旅遊一定會再選擇君品。
十分感謝服務員Miyu的招待，甜美可愛又友善，令我們更喜歡這一間洒店。更多","親愛的MLeung831您好，歡迎您蒞臨下榻君品酒店。
很開心得知您在君品與我們度過了美好的時光！謝謝您對於我們飯店地理位置、舒適的客房以及多樣化的早餐選擇的肯定，也謝謝您特別對於我們專業周到的服務人員Miyu讚賞，能夠給予您舒適完善的住宿體驗是我們一直不斷追求的目標。衷心期待您不久的將來可以再次於君品與您見面，讓我們為您提供更...更多"
台北花園大酒店Taipei Garden Hotel,ViviWang1225,周年紀念日,5,香港,2018年12月,這次是與妻子的2周年紀念日，服務人員親切有禮，特別是櫃檯的Vito以及Charles快速的辦理入住手續後，替我們查詢了能夠吃宵夜的地方，並幫我們叫了計程車，一切都是那麼的順利，讓晚班機的我們，在台北的冬夜，能夠感到溫暖。,
台北花園大酒店Taipei Garden Hotel,taengoo,Great hotel,5,新加坡新加坡,,"不錯的早餐。
房間也非常乾淨，裝潢都算蠻新的。
飯店的地點不錯。。
附近就有24hr的家樂福。有空時可以去走走買些伴手禮~",
台北花園大酒店Taipei Garden Hotel,35jeremyo,great hotel,5,,,房間的裏面裝潢非常乾淨和新。早餐也非常不錯。測對面有24小時大賣場，可以自由活動去買伴手禮。非常推薦的飯店！,
台北花園大酒店Taipei Garden Hotel,Fearless719595,帶旅客入住,4,,2018年12月,"舒適優雅的環境，招呼周詳的服務人員
空間寬敞設備齊全，大人小孩均能感受溫馨的照護。早班服務人員鍾承樺笑容甜美，招呼特好",
台北花園大酒店Taipei Garden Hotel,Sightseer796769,美味料理,5,,2018年12月,再次造訪台北花園，餐廳菜色改變了，一樣美味，每次聚餐都會第一個想到這裡，大廳的聖誕佈置也很特別，居然是金字塔，下次一定還會再來的。,
日勝生加賀屋國際溫泉飯店Radium-Kagaya,veggie0166,傳統日式温泉飯店,5,,2018年10月,非常傳統的日式温泉飯店，招待十分細心，房間很大，有一點老氣但維持得很清潔乾淨。房間內有足夠二人同用的温泉，很舒適！早餐是最令人驚喜的部分，豐富得不得了，日式中式西式甚麼款式都有，味道也很好，非常推薦這間飯店！,
日勝生加賀屋國際溫泉飯店Radium-Kagaya,mingyen26,還會讓我想再度照訪的溫泉飯店~,5,,2018年12月,"這次是為了慶祝我與老婆的結婚紀念日,所以特別選擇了北投加賀屋,再來住之前,我已經住過能登的加賀屋,所以心理有些許的期待,從開車到達門口的接待,到大廳辦理住房,還有管家的貼心服務都讓我覺得窩心,尤其要特別提到為小朋友準備的餐點我兒子誇讚不已,而飯店準備的和服與浴衣讓我們在北投公園裡拍下了很多很棒照片,雖然北投加賀屋比起能登加賀屋來...更多","親愛的貴賓您好:
感謝您選擇日勝生加賀屋溫泉飯店，並且給予我們正面的評價，對於我們來說真的是莫大的鼓勵並且感到十份榮幸及高興。
能讓您重溫去日本加賀屋的感動，是我們的光榮！我們最引以為傲的正是「從硬體到軟體通通跟日本加賀屋一樣，唯一的不同就是『我們會講中文』！！！」
期待您的再次光臨，我們在暑假期間會有日本廟會的經典遊戲攤位，歡...更多"
日勝生加賀屋國際溫泉飯店Radium-Kagaya,josiuching,在這家酒店泡溫泉真是太棒了,5,香港,,這是我第三次住這家酒店了，因為溫泉非常好。水很清澈，溫度剛剛好。 提供的食物總是美味可口，酒店的員工都很友好和樂於助人。這家酒店的氛圍讓你感到很放鬆。房間寬敞舒適。如果你不想去公共浴室，你可以在房間里有自己的溫泉。更多,"Dear Guest

Thank you for leaving this nice comment after your recent trip at our Hotel. 
We are glad that...更多"
