hotels,names,titles,star_ratting,location,date,comments,replies
台北威斯汀六福皇宮The Westin Taipei,BTX1120,My last time of Westin Taipei ,5,香港,2018年11月,這是我最後一次住在這裏的日子 我很喜歡這裏的前台服務 還有很好吃的上海菜 最重要是竟然有個電影院以及邱吉爾雪茄吧 可惜一切都會完了 希望在不久的將來會再見更多,"親愛的 BTX1120，您好!
感謝您寶貴時間於TripAdvisor給予本飯店意見反饋。
感謝您選擇入住台北威斯汀六福皇宮，提供全體同仁一個為您竭誠地服務的機會。
我們很開心得知您滿意飯店同仁的服務。謝謝您不吝分享住宿心得, 是令全體員工士氣振奮不斷的精神來源。
我們將持續為您帶來優質的服務，未來仍祈續予本公司愛護與支持，我們...更多"
台北威斯汀六福皇宮The Westin Taipei,WCYY,邱吉爾爵士雪茄館氣氛真的很好,4,台灣台北,2018年11月,帶客戶到邱吉爾雪茄館，氣氛好，人也不多，酒單有很多選擇，食物的部分，松露薯條跟焗烤麵味道真的很棒，一份薯條兩個人搭酒份量非常足，倒是牛排的部分有點過熟，點了5分，吃起來像是8-9分熟的。裡面服務人員態度蠻不錯，但是不太喜歡告知客戶低消時候的方式，可以等我點不夠金額再跟我說...更多,"親愛的 WCYY，您好!
感謝您寶貴時間於TripAdvisor給予本飯店意見反饋。
感謝您選擇入住台北威斯汀六福皇宮，提供全體同仁一個為您竭誠地服務的機會。
我們很開心得知您滿意飯店同仁的服務。謝謝您不吝分享住宿心得, 是令全體員工士氣振奮不斷的精神來源。
我們將持續為您帶來優質的服務，未來仍祈續予本公司愛護與支持，我們非常期...更多"
台北威斯汀六福皇宮The Westin Taipei,NS_HSU,房間風格溫暖 服務人員親切又出色 位於市中心地段 近小巨蛋,5,台灣台北,2018年11月,"六福皇宮Westin年底熄燈，大家都來say goodbye，
因訂房太踴躍，飯店房況極滿，這次在威斯汀有舉辦活動，優越白金會員入住升等至行政樓層，房間沒有想像中小，窗戶景觀是飯店後方景，視野算遼闊，有機會可看到松山機場的飛機降落喔！浴缸比一般飯店的還大，淋浴間採乾濕分離，因旅館在1999年開幕已近20年歷史，看起來會較為老舊一...更多","親愛的 NS_HSU，您好!
感謝您寶貴時間於TripAdvisor給予本飯店意見反饋。
感謝您選擇入住台北威斯汀六福皇宮，提供全體同仁一個為您竭誠地服務的機會。
我們很開心得知您滿意飯店同仁的服務。謝謝您不吝分享住宿心得, 是令全體員工士氣振奮不斷的精神來源。
我們將持續為您帶來優質的服務，未來仍祈續予本公司愛護與支持，我們非...更多"
台北威斯汀六福皇宮The Westin Taipei,7197193,最後一次住六褔皇宮,5,香港,2018年11月,"如果有看過「撒嬌的女人」這套電影一定認得Westin 六福皇宮的走廊。真可惜，每次來台灣，除了Le Meridian, 這酒店都會是首選之一。Westin 要離開快台灣了，唯有下次試試Sheraton 。更多","親愛的 7197193，您好!
感謝您寶貴時間於TripAdvisor給予本飯店意見反饋。
感謝您選擇入住台北威斯汀六福皇宮，提供全體同仁一個為您竭誠地服務的機會。
我們很開心得知您滿意飯店同仁的服務。謝謝您不吝分享住宿心得, 是令全體員工士氣振奮不斷的精神來源。
我們將持續為您帶來優質的服務，未來仍祈續予本公司愛護與支持，我們...更多"
美麗信花園酒店Miramar Garden Taipei,J7313CA_,沒有五星級該有的水準，讓人失望,2,台灣台中,2018年11月,"住了507號房，安排三天兩夜旅行，以下是感受到的優缺點

1. 洗澡
第一天晚上洗澡的時候，發現水壓不足，且冷熱水切換很慢，通常要等個20-30秒，尤其是熱水轉冷水的時候，冷水來的特別慢，讓人容易燙到，因此讓我洗澡感到非常不方便，當晚有請飯店人員修理，但第一次修理過後仍不見改善，當時太晚了，索性隨便洗洗就睡了
隔天出門前，請飯店...更多",
美麗信花園酒店Miramar Garden Taipei,102pennyt,乾淨,4,台灣台北,2018年10月,"酒店有一點年紀了但維持得十分乾淨，泳池尤其非常棒，是很舒適的溫度。我們帶著一歲的寶寶在泳池裡度過了愉快的假期。
離捷運站有些遠，但如果搭計程車到各處都方便。早餐的價格不便宜但食物有點粗糙，如果想在外面吃東西則得走上好一段距離。先前爬文看很多旅客也提到一點：每天只供應兩罐瓶裝水，便利商店又不近，還得大老遠去買大罐瓶裝水扛進房，是花...更多",
美麗信花園酒店Miramar Garden Taipei,why1108kj,服務非常的親切、細膩,5,台灣高雄,2018年9月,"9月26日、27日在台北有好幾個會議，晚上就住在「 美麗信花園酒店」~ 第一次住在這個飯店， 這是因為我比較喜歡嘗試不一樣的飯店，而且在網路上訂閱還 蠻划算的， 住宿的結果比我預期的還要好 !
首先我打電話詢問住宿的情況，飯店的設施，有一位謝姓的值班經理講得很清楚， 我也特別要一個窗戶可以看到很多車子的房間 ， 這樣子下一次帶老...更多",
美麗信花園酒店Miramar Garden Taipei,skymeipei,商務旅行,5,台灣台中,2018年6月,"雖然是有點年紀的飯店
但整個空間
靜謐沈穩的氣質
衛浴不規則空間設計感
早餐選擇多樣化-現煮拉麵/煎蛋台
用餐環境🈶️庭院造景 綠意盎然
房間還滿親民的
唯有附近餐廳/便利商店有點距離",
美麗信花園酒店Miramar Garden Taipei,msjolam,房間很大，但是有點過時,4,香港,,地理位置不是很好，不是很靠近地鐵站，停留在靠近立交橋出口的繁忙道路。房間很大，浴室很大很乾凈，但是沒有提供瓶裝水，有點失望。行李員很樂於助人，工作人員也很好。遊泳池不大，但有日式公共浴池和桑拿（原文為sunna，應為sauna），非常乾淨，條件很好。更多,"Dear msjolam

Thank you very much for choosing Miramar Garden Taipei for your recent stay in Taipei. We also appreciate...更多"
台北寒舍艾美酒店Le Meridien Taipei Hotel,hellohang,舒適的酒店,4,,2018年6月,貫徹艾美酒店的舒適，房間不算很大但很新淨。前台服務很好，有不錯的餐廳，下次到台北的話會再來。適合家庭旅客。,
台北寒舍艾美酒店Le Meridien Taipei Hotel,bird415,咖啡廳的咖啡不錯,4,香港,,"週邊都是購物中心, 把你的老婆或女朋友帶過來, 她們一定滿心歡喜。 相對於價格來說, 酒店的設備品質不多不少。 順帶一提, 記得試一下他們大堂旁邊的咖啡廳, 咖啡很有特式。更多","Dear bird415,

Greetings from Le Meridien Taipei.

Thank you for staying with us while you were in Taipei. We appreciate...更多"
台北寒舍艾美酒店Le Meridien Taipei Hotel,Scenic808087,拜訪國外客戶,5,台灣台北,2018年12月,此次因客人住寒舍艾美酒店，因客人行程短暫，要求我來他酒店聊聊，怕停車不方便，我坐藍色捷運前來，離3號出口約5分鐘走路還算方便。寒舍艾美酒店外觀很平凡，但內部裝潢就高貴典雅，有五星級酒店的風範，服務人員服務佳，很快找到客人，我們在此談得很輕鬆愉快，真是一個不錯的酒店。,"Dear Scenic808087,

非常感謝您蒞臨台北寒舍艾美酒店, 亦非常感激您樂意抽空分享您的體驗。

您的支持是我們成長的動力; 飯店同仁將秉持一貫的標準來為每一位光臨飯店的客人提供最好的服務。

希望我們很快能再次為您服務。

祝您 順心

台北寒舍艾美酒店"
台北寒舍艾美酒店Le Meridien Taipei Hotel,Garfieldnk,會再回來入住的好飯店,5,台灣台北,2018年12月,這家飯店就位在信義區的中心，不論是離捷運站或是百貨公司都很方便，飯店的人員服務也非常好，探索廚房及寒舍食譜也都很好吃。,"Dear Garfieldnk,

非常感謝您支持台北寒舍艾美酒店, 亦非常感激您樂意抽空分享您的體驗。

我們很榮幸能提供您滿意的服務及餐點。飯店同仁將秉持一貫的標準來為每一位光臨飯店的客人提供最好的服務。

希望我們很快能再次見到您。

祝您 順心

台北寒舍艾美酒店敬上"
台北寒舍艾美酒店Le Meridien Taipei Hotel,kmetch,台北投票,5,台灣中山區,2018年11月,帶家人由深圳回台灣投票。艾美位置在信義區眾百貨公司隔壁。非常方便。走到台北101可以走二樓空橋就可以到. 微風廣場 捷運。誠品書店多在這區！,"kmetch您好,

由衷地感謝您選擇台北寒舍艾美酒店作為旅遊下榻的飯店。有您的鼓勵我們定會更用心追求進步，期待很快能再次會您服務！

祝您一切順心如意

台北寒舍艾美酒店敬上"
台北W飯店W Taipei,bella0903,Meeting,5,,2018年12月,今天來參加策略會議室2覺的一進門就有音樂很驚喜 場地自然光也很挑光很漂亮 可以看到10游泳池景致很棒 Iris服務人員服務也很棒 ！！,"Dear bella0903,

感謝您蒞臨台北W飯店參加會議，並與我們分享您的經驗！很開心Iris的服務以及整體會議環境能獲得您的肯定，期待未來很快能再度為您服務，為您帶來更多完美的W體驗。

唐皓維
台北W飯店 總經理"
台北W飯店W Taipei,yiyunchiang,會議,5,台灣台北,2018年12月,"服務人員非常優質以及專業，
待人親切和善，有狀況隨時能即時處理。
會議廳投影設備完善。
當然，周邊環境音樂好聽！","親愛的yiyunchiang您好

謝謝您撥冗在此留下如此美好的評論，很榮幸得知我們所提供的活動場地讓您感到滿意，能夠協助您們舉辦會議並讓過程一切順利圓滿也是我們最大的心願！
我們期待未來能夠盡快再度為您服務，為您帶來另一段W完美體驗！

唐皓維
台北W飯店 總經理"
台北W飯店W Taipei,SukiWang0844,完美。,5,,2018年12月,"方便、乾淨、風景美、員工有禮貌、早餐好吃又多選擇. 來台北工作的唯一選擇, 很多人說房價有點貴, 但我還是覺得很划算, 大愛W <3","親愛的SukiWang0844您好，

謝謝您撥冗填寫的評論，很高興得知您喜愛我們豐富多樣的早餐選擇以及親切的服務，能夠讓您的住宿體驗印象深刻，是我們最大的榮幸，再次謝謝您對台北W飯店的支持與愛戴。

我們期待未來能夠盡快再度為您服務!

唐皓維
台北W飯店 總經理"
台北W飯店W Taipei,ses4818888,活動紀錄拍攝,5,台灣台北,2018年12月,工作關係來到這邊拍攝！光線、音響、環境佳。服務人員Elmo 特別親切、熱情！很開心有機會來到這邊拍攝！服務人員的好態度讓我這在工作起來特別輕鬆不感壓力！,"親愛的ses4818888, 


感謝您蒞臨台北W飯店，並與我們分享您在這裡工作的體驗！真的感到非常榮幸我們的人才Elmo的服務讓您感到滿意，也期待未來很快能再度為您服務，為您帶來更多完美的W體驗。


唐皓維 台北W飯店 總經理"
台北W飯店W Taipei,ashan1234,日本說明會,5,,2018年12月,今天參加策略會議室有Iris的幫忙 以及場地的優質性還有活動配置 還有音樂也很棒 今天參加會議覺的很完美 下次會推薦朋友來w飯店來辦！！,"親愛的ashan1234, 


感謝您選擇台北W飯店，並與我們分享您在這裡舉辦活動的經驗！很榮幸得知人才Iris和宴會團隊的服務能獲得貴單位的肯定，您的肯定是我們最大的鼓勵！再次謝謝您撥空寫下寶貴的留言，也期待未來很快能再度為您服務。


唐皓維 台北W飯店 總經理"
台北萬豪酒店Taipei Marriott Hotel,nng1122,一家很棒的台北酒店,5,馬來西亞檳城,,雖然這是我第一次入住台北萬豪酒店（和SPG集團合併之後），但是我認為這裏非常適合住宿，體驗格外的棒！酒店對客人的服務，從你抵達之前，入住，和離開一直都熱情為您服務。下次我來台北旅行的時候，一定會再次入住這家酒店。更多,"Dear nng1122

Thank you for taking your time to review our hotel. We are incredibly grateful to have your review...更多"
台北萬豪酒店Taipei Marriott Hotel,joanne991978,萬豪白金體驗,5,台灣,2018年12月,"因為是白金會員,所以訂了這裡,升等高摟景觀房,lounge的食物也很滿意,但是離市區肖遠了一些,附近有美麗華摩天輪,和大佳河濱公園.
下次如果來這附近,還是會考慮入住歐更多",敬愛的joanne991978：台北萬豪酒店座落于新興大直區，周邊富有多樣化的生活機能和眾多娛樂設施，附近的美堤河濱公園更是美好假期悠閒放鬆的好去處；除此之外，便利的地理位置也提供了國際旅客絕佳的方便性，更是距離故宮博物院最近的頂級國際酒店。我們誠摯期待您再度蒞臨城市綠洲台北萬豪酒店，體驗旅獲精彩的熱情服務。－台北萬豪酒店管理團...
台北萬豪酒店Taipei Marriott Hotel,Experience811172,冷色簡約裝潢,4,台灣台北,2018年7月,偏冷色系的裝潢，樸素的房間擺設。床非常好睡，可以一覺天亮。游泳池是露天式，夏天很適合上去游泳，有陽光照不會太冷。,敬愛的 Experience811172：台北萬豪酒店致力於提供全球旅人旅獲精彩的旅宿體驗，我們很開心您能享受新興大直區帶給您的美好旅入體驗，我們全體同仁期待您再度蒞臨體驗旅獲精彩的熱情服務！－台北萬豪酒店管理團隊
台北萬豪酒店Taipei Marriott Hotel,tzuwei0312,第一次來台北的萬豪酒店！,5,台灣台北,2018年12月,"個人第一次來到台北的萬豪酒店，位於台北萬豪酒店內湖區豪華飯店 · 樂群二路199號，入住後再18樓行館飯店俯瞰前有大佳碼頭港阜，又有河濱公園，後有美麗華百貨及摩天輪廣場。而19樓又有行政酒廊超讚！如下圖

""地點不錯 中餐廳餐點還可以。",敬愛的 tzuwei0312：台北萬豪酒店感謝您的支援與愛護，也很開心您感受了美好的旅宿體驗，希望在不久的將來還能再度為您提供用心有禮的熱情服務。－台北萬豪酒店管理團隊
台北萬豪酒店Taipei Marriott Hotel,SammiH152,高檔的飯店,4,,2018年12月,之前幫客戶訂這飯店，他被升等到套房！ 讓我超心動！ 可惜假日入住 就沒被升等且沒view ! 但lounge 營業時間很長， 游泳池， 健身房都挺優的！,敬愛的 SammiH152：台北萬豪酒店致力於提供全球旅人旅獲精彩的旅宿體驗，我們很開心您能享受新興大直區帶給您的美好旅入體驗，我們全體同仁期待您再度蒞臨體驗旅獲精彩的熱情服務！－台北萬豪酒店管理團隊
台北美福大飯店Grand Mayfull Hotel Taipei,Lukeyang0223,房間寬敞乾淨整潔櫃台服務好,4,台灣新北,2018年12月,"一進去到大廳挑高設計加上超華麗大水晶吊燈，氣宇軒昂。左手邊是獨立Check in空間，有種VIP的待遇。再辦理住宿時服務人員有主動詢問是否有亞洲萬里通會員可以做累積，太棒了👏
住宿體驗：
房間相當寬敞浴室有大浴缸洗手台有2個，早上起床就沒有搶著用的問題，冰箱的mini bar都是免費的還有附膠囊咖啡雖然不知道是什麼牌子的但非常...更多","親愛的顧客，您好!

謝謝您選擇台北美福大飯店，更感謝您對本飯店的肯定與讚賞。

台北美福大飯店致力於提供賓客們體貼入懷的溫暖服務，有了您的支持與鼓勵，本飯店將依此做為日後的服務準則，我們將持續提供每位到訪賓客更完善的服務，再次謝謝您的肯定。

台北美福大飯店誠摯邀請您再度光臨，更期盼很快能再有為您服務的機會。"
台北美福大飯店Grand Mayfull Hotel Taipei,flyingkitten11,絶美的設計，但服務有待改善,4,香港,2018年11月,"大堂、房間都走高檔優雅路線，房間設計很美很舒適。
但服務水平有待改善，尤其是早餐餐廳的服務生，三個早上(十一月二十一至二十三日）不同的服務生都好像很討厭他們的工作或可能是討厭房客？更多","親愛的顧客，您好！

非常感謝 閣下蒞臨台北美福大飯店，並抽出寶貴時間與我們分享您的住宿及用餐感受。

我們非常重視每一位賓客的分享與建議，本飯店已將您的寶貴意見轉達予該負責單位主管，並將其納入檢討會議中研擬相關改善事項，並加強服務人員的訓練。

非常感謝您對台北美福大飯店的指教與愛護，讓本飯店有改進與成長的機會，爾後如有任何問...更多"
台北美福大飯店Grand Mayfull Hotel Taipei,jamcsedean,各項服務及環境 耳目一新,5,Taipei City,2018年10月,"因住家在台北市關係,從沒想過要住台北市飯店,不過這次因機緣,入住台北美福大飯店,真的讓我感覺非常友善的五星級飯店,不論環境及房間都很舒適,對待小朋友也很有禮貌,服務真的很好,雖然沒有親子遊戲室,但是一樣讓一家大小心情好,重點是餐點好吃,早餐還有熟成牛肉麵,絕對值得大推薦更多","親愛的顧客，您好!

謝謝您選擇台北美福大飯店，更感謝您對本飯店的肯定與讚賞。

台北美福大飯店致力於提供賓客們體貼入懷的溫暖服務，有了您的支持與鼓勵，本飯店將依此做為日後的服務準則，我們將持續提供每位到訪賓客更完善的服務，再次謝謝您的肯定。

您的寶貴意見是本飯店不斷成長的原動力，台北美福大飯店誠摯邀請您再度光臨，更期盼很快能..."
台北美福大飯店Grand Mayfull Hotel Taipei,tweety_tracyi,值得再次入住,3,香港,2018年9月,飯店乾淨舒適，有氣派既感覺，房間光線充足，空間感不錯，但缺點係離捷運站有d遠，附近好少餐廳，如果主要目的係渡假放鬆既都無問題更多,"親愛的顧客，您好!

謝謝您選擇台北美福大飯店，更感謝您對本飯店的肯定與讚賞。

台北美福大飯店致力於提供賓客們體貼入懷的溫暖服務，有了您的支持與鼓勵，本飯店將依此做為日後的服務準則。台北美福大飯店館內亦有七間主題餐廳，歡迎您下次蒞臨品嚐。

您的寶貴意見是本飯店不斷成長的原動力，台北美福大飯店誠摯邀請您再度光臨，更期盼很快能再..."
台北美福大飯店Grand Mayfull Hotel Taipei,CrystalW1765,漂亮飯店舒適住房,4,,2018年9月,很漂亮的飯店，check in 櫃台非常有質感，服務非常親切，房間20坪兩大床很舒適，浴室和廁所空間很大，還有陽台正好看到泳池，附迎賓水果，冰箱飲料全免費，還有咖啡茶和點心，很棒的住房體驗！更多,"親愛的顧客，您好!

謝謝您選擇台北美福大飯店，更感謝您對本飯店的肯定與讚賞。

台北美福大飯店致力於提供賓客們體貼入懷的溫暖服務，有了您的支持與鼓勵，本飯店將依此做為日後的服務準則，我們將持續提供每位到訪賓客更完善的服務，再次謝謝您的肯定。

您的寶貴意見是本飯店不斷成長的原動力，台北美福大飯店誠摯邀請您再度光臨，更期盼很快能..."
亞士都飯店Astar Hotel,ppp5718,設施服務OK,3,台灣桃園,2018年12月,"在熱鬧的夜生活林森北路,飯店有沉靜溫馨的氣氛,沒有早餐的餐廳，有大小適中的房間,雖有浴缸可泡,但卻發出空調的低頻噪音，這家飯店未如預期。",
亞士都飯店Astar Hotel,shayasan,雖然舊 但很乾淨,4,台灣中和,2017年12月,因緣際會下入住的飯店，房間大，且有日本新聞台。大廳很有質感。雖然可能舊了點，但房內卻非常乾淨，令人意外。,
亞士都飯店Astar Hotel,kose c,很有日本味道,3,,2016年8月,完全日系的飯店，大廳不大也無餐廳，商務中心的設計風格是好的。一進客房，迎面而來的就是那種去日本住飯店的味道，或許很籠統，但這真的很神奇，且房間坪數算大，有著懷舊的家具，整體而言算是CP值高的。,
亞士都飯店Astar Hotel,akks47ster,"很舊,但依然很棒",3,馬來西亞吉隆坡,,"這家酒店很老,還是80年代的裝修,不過保養得當,還是很乾凈。房間面積寬敞,完全沒有局促的感覺。也許有些人不喜歡這種老式風格,不過我們還ok,畢竟很乾凈、維護得很好。前台服務很好,你說普通話的話,溝通更加順暢。酒店位置很好,飯店外面街兩邊都有24小時便利店。隔壁就有個小餐廳,提供地道的台灣美食。周圍還有幾家日料餐廳,味道很不錯。酒...更多",
亞士都飯店Astar Hotel,NE_Traveller_3,"不錯的選擇,靠近高鐵站",3,英國紐卡斯爾,,"我之所以選擇這家酒店是因為從高鐵站步行就能到。登記入住很迅速,沒什麼問題,而且我被房間的大小震驚了。房間里的無線網絡很好用。這家酒店並沒什麼讓人記憶深刻的,但是對於短暫停留的人而言還是很不錯的。記得去酒店的商務中心喝杯免費的茶吧。",
第一大飯店First Hotel,greta169,老舊但是服務很不錯的飯店,4,Taipei,2017年6月,第一飯店雖舊但是內裝還算是OK的。附近交通便利，大概步行5分鐘就可以抵達松江婦精湛，到市區哪裡都不算遠。附近也有很多各國料理的餐廳供君選擇。就地理位置來說，第一飯店也算是不錯的選擇。,
第一大飯店First Hotel,Anthony_Ang,很老舊但是很可靠,4,"Quezon City, Quezon City, Philippines",,這是台北最古老的旅館之一。房間和用餐區依然完好。他們提供自助早餐，但是菜單品種有限。附近有商店、餐館和超市，地理位置很方便。不過酒店無法避免一些陳舊的地方有生鏽的氣味。工作人員很好，在我逗留的6天里，我的房間里一切都好，也沒有丟東西。地毯很舊了，相信管理人員之後能換新的地毯。,
第一大飯店First Hotel,beth r,普通的酒店,4,,,酒店整體來看很一般，但是當回到台灣的時候，我們想再呆一段時間。工作人員很不錯 .有自助早餐. .可以步行到捷運，如果你想在旅館周邊散步，這是一個不錯的地方。無線網絡連接很不錯。,
第一大飯店First Hotel,一位來自中國的 TripAdvisor 會員,新年家庭遊,4,,,酒店應該有點年頭了還是使用机械門鎖，但是設施保養得不錯，衛生整潔，步行到松江南京捷運站大約4分鐘非常方便。 一樓有意粉店和咖啡廳，馬路對面還有土耳其和印度餐廳、吉野家快餐。,
第一大飯店First Hotel,sk3318,地點佳,3,,2016年10月,位於松江南京站附近，步行約五分鐘即可到達，位於交通要道上，外出購買日常用品皆算方便，服務還算可以，是有年代的飯店了。,
六福客棧The Leofoo Hotel,Jennytraveler123,回娘家,5,,2018年12月,"同學遠嫁國外多年,最近回台探親並與老同學相聚.我幫她訂在六福客棧.取其位處市中心,交通便利, 價格合理又附早餐.她住得很開心,大讚房務阿姨很親切,人很好.",親愛的貴賓您好，感謝您蒞臨六福客棧，很開心有為您服務的機會。再次感謝您的蒞臨，希望未來很快能有再次為您服務的機會，我們也將以更卓越的服務，讓您再次感到驚艷。
六福客棧The Leofoo Hotel,Loliben85,初訪台北,5,,2018年11月,和朋友第一次造訪台北，選擇入住六福，雖沒比較過其他的飯店，但是六福給我的感受是簡單舒適，乾淨溫馨，員工們都很親切，周邊也商店林立，真的很不錯，如果下次有機會再訪台北會再來。,親愛的貴賓您好，感謝您蒞臨六福客棧，很開心有為您服務的機會。再次感謝您的蒞臨，希望未來很快能有再次為您服務的機會，我們也將以更卓越的服務，讓您再次感到驚艷。
六福客棧The Leofoo Hotel,Thanada121888,"住的好,吃的滿",5,,2018年12月,"我們線上買了一種住套房有早餐有晚餐的方案,
入住時剛好遇到日本學生團畢業旅行!!飯店很熱鬧,早餐還要排隊…但其實還ok!!我們覺得住的不錯,
也吃的滿足!!",親愛的貴賓您好，感謝您蒞臨六福客棧，很開心有為您服務的機會。再次感謝您的蒞臨，希望未來很快能有再次為您服務的機會，我們也將以更卓越的服務，讓您再次感到驚艷。
六福客棧The Leofoo Hotel,Quitme,便利兼具舒適首選,5,,2018年10月,來台北出差拜訪客戶，六福就位於金融工商群聚的中心，加上又有捷運及多線公車加持，我穿梭於雙北之中甚是便利，非常推薦商務有需求的人。,親愛的貴賓您好，感謝您蒞臨六福客棧，很開心有為您服務的機會。再次感謝您的蒞臨，希望未來很快能有再次為您服務的機會，我們也將以更卓越的服務，讓您再次感到驚艷。
